{
  "schema_version": "1.0.0",
  "synthetic": true,
  "origin": "independent",
  "source_ref": "synthetic-handwritten-fixture",
  "review_ref": "test-author",
  "annotation_version": "1",
  "events": [
    {
      "id": "g1",
      "batch": "b",
      "kind": "change",
      "asset": "x",
      "time": "2026-01-01T02:00:00Z",
      "sample_sha256": "bbbbbbbbbbbbbbbbbbbbbbbbbbbbbbbbbbbbbbbbbbbbbbbbbbbbbbbbbbbbbbbb"
    },
    {
      "id": "g2",
      "batch": "b",
      "kind": "change",
      "asset": "x",
      "time": "2026-01-01T02:20:00Z",
      "sample_sha256": "bbbbbbbbbbbbbbbbbbbbbbbbbbbbbbbbbbbbbbbbbbbbbbbbbbbbbbbbbbbbbbbb"
    }
  ],
  "disputed_intervals": []
}
